v1,v2,,,
NOT SPAM,"Good afternoon loverboy ! How goes you day ? Any luck come your way? I think of you, sweetie and send my love across the sea to make you smile and happy",,,
NOT SPAM,If i start sending blackberry torch to nigeria will you find buyer for me?like 4a month. And tell dad not to buy bb from anyone oh.,,,
NOT SPAM,"&lt;#&gt; %of pple marry with their lovers... becz they hav gud undrstndng dat avoids problems. i sent dis 2 u, u wil get gud news on friday by d person you like. And tomorrow will be the best day of your life. Dont break this chain. If you break you will suffer. send this to  &lt;#&gt;  frnds in &lt;#&gt;  mins whn u read...",,,
NOT SPAM,Yo dude guess who just got arrested the other day,,,
NOT SPAM,Shuhui say change 2 suntec steamboat? U noe where? Where r u now?,,,
NOT SPAM,What does the dance river do?,,,
NOT SPAM,"Yetunde, i'm sorry but moji and i seem too busy to be able to go shopping. Can you just please find some other way to get what you wanted us to get. Please forgive me. You can reply free via yahoo messenger.",,,
NOT SPAM,Hey i will be really pretty late... You want to go for the lesson first? I will join you. I'm only reaching tp mrt,,,
SPAM,"HOT LIVE FANTASIES call now 08707509020 Just 20p per min NTT Ltd, PO Box 1327 Croydon CR9 5WB 0870..k",,,
NOT SPAM,Bbq this sat at mine from 6ish. Ur welcome 2 come,,,
NOT SPAM,"I don't know, same thing that's wrong everyso often, he panicks starts goin on bout not bein good enough ‰Û_",,,
NOT SPAM,Alright. I'm out--have a good night!,,,
NOT SPAM,Did you try making another butt.,,,
NOT SPAM,Hope you are feeling great. Pls fill me in. Abiola,,,
NOT SPAM,I though we shd go out n have some fun so bar in town or something ‰ÛÒ sound ok?,,,
NOT SPAM,"1) Go to write msg 2) Put on Dictionary mode 3)Cover the screen with hand, 4)Press  &lt;#&gt; . 5)Gently remove Ur hand.. Its interesting..:)",,,
SPAM,"Bears Pic Nick, and Tom, Pete and ... Dick. In fact, all types try gay chat with photo upload call 08718730666 (10p/min). 2 stop texts call 08712460324",,,
SPAM,"500 New Mobiles from 2004, MUST GO! Txt: NOKIA to No: 89545 & collect yours today!From ONLY å£1 www.4-tc.biz 2optout 087187262701.50gbp/mtmsg18 TXTAUCTION",,,
NOT SPAM,We're finally ready fyi,,,
NOT SPAM,Auntie huai juan never pick up her phone,,,
SPAM,Double Mins & Double Txt & 1/2 price Linerental on Latest Orange Bluetooth mobiles. Call MobileUpd8 for the very latest offers. 08000839402 or call2optout/LF56,,,
NOT SPAM,"Ya tel, wats ur problem..",,,
SPAM,No. 1 Nokia Tone 4 ur mob every week! Just txt NOK to 87021. 1st Tone FREE ! so get txtin now and tell ur friends. 150p/tone. 16 reply HL 4info,,,
NOT SPAM,i dnt wnt to tlk wid u,,,
NOT SPAM,"We spend our days waiting for the ideal path to appear in front of us.. But what we forget is.. \paths are made by walking.. not by waiting..\"" Goodnight!""",,,
NOT SPAM,Its ok my arm is feeling weak cuz i got a shot so we can go another time,,,
NOT SPAM,Please reserve ticket on saturday eve from chennai to thirunelvali and again from tirunelvali to chennai on sunday eve...i already see in net..no ticket available..i want to book ticket through tackle ..,,,
NOT SPAM,"Storming msg: Wen u lift d phne, u say \HELLO\"" Do u knw wt is d real meaning of HELLO?? . . . It's d name of a girl..! . . . Yes.. And u knw who is dat girl?? \""Margaret Hello\"" She is d girlfrnd f Grahmbell who invnted telphone... . . . . Moral:One can 4get d name of a person"," bt not his girlfrnd... G o o d n i g h t . . .@""",,
NOT SPAM,That's ok. I popped in to ask bout something and she said you'd been in. Are you around tonght wen this girl comes?,,,
NOT SPAM,All e best 4 ur exam later.,,,
NOT SPAM,Hope ur head doesn't hurt 2 much ! Am ploughing my way through a pile of ironing ! Staying in with a chinky tonight come round if you like.,,,
NOT SPAM,Oh k.i think most of wi and nz players unsold.,,,
NOT SPAM,"Haha... Where got so fast lose weight, thk muz go 4 a month den got effect... Gee,later we go aust put bk e weight.",,,
NOT SPAM,"I wonder how you got online, my love ? Had you gone to the net cafe ? Did you get your phone recharged ? Were you on a friends net ? I think of you, boytoy",,,
NOT SPAM,"Haha just kidding, papa needs drugs",,,
NOT SPAM,"Thk shld b can... Ya, i wana go 4 lessons... Haha, can go for one whole stretch...",,,
NOT SPAM,Oh ok..,,,
NOT SPAM,R we still meeting 4 dinner tonight?,,,
NOT SPAM,Thats cool! I am a gentleman and will treat you with dignity and respect.,,,
NOT SPAM,Shall i start from hear.,,,
NOT SPAM,Then we wait 4 u lor... No need 2 feel bad lar...,,,
NOT SPAM,No did you check? I got his detailed message now,,,
NOT SPAM,You have registered Sinco as Payee. Log in at icicibank.com and enter URN  &lt;#&gt;  to confirm. Beware of frauds. Do NOT share or disclose URN to anyone.,,,
NOT SPAM,"No, I decided that only people who care about stuff vote and caring about stuff is for losers",,,
NOT SPAM,Kaiez... Enjoy ur tuition... Gee... Thk e second option sounds beta... I'll go yan jiu den msg u...,,,
NOT SPAM,You have registered Sinco as Payee. Log in at icicibank.com and enter URN  &lt;#&gt;  to confirm. Beware of frauds. Do NOT share or disclose URN to anyone.,,,
NOT SPAM,cool. We will have fun practicing making babies!,,,
NOT SPAM,Actually getting ready to leave the house.,,,
NOT SPAM,K..k..any special today?,,,
SPAM,"URGENT, IMPORTANT INFORMATION FOR O2 USER. TODAY IS YOUR LUCKY DAY! 2 FIND OUT WHY LOG ONTO HTTP://WWW.URAWINNER.COM THERE IS A FANTASTIC SURPRISE AWAITING FOR YOU",,,
NOT SPAM,Then we gotta do it after that,,,
NOT SPAM,"I've got ten bucks, jay is being noncomittal",,,
NOT SPAM,Where at were hungry too,,,
NOT SPAM,Pls speak to that customer machan.,,,
NOT SPAM,somewhere out there beneath the pale moon light someone think in of u some where out there where dreams come true... goodnite &amp; sweet dreams,,,
NOT SPAM,"Wen ur lovable bcums angry wid u, dnt take it seriously.. Coz being angry is d most childish n true way of showing deep affection, care n luv!.. kettoda manda... Have nice day da.",,,
SPAM,Dear U've been invited to XCHAT. This is our final attempt to contact u! Txt CHAT to 86688 150p/MsgrcvdHG/Suite342/2Lands/Row/W1J6HL LDN 18 yrs,,,
NOT SPAM,So wats ur opinion abt him and how abt is character?,,,
NOT SPAM,Jay is snickering and tells me that x is totally fucking up the chords as we speak,,,
NOT SPAM,No..few hours before.went to hair cut .,,,
NOT SPAM,No wonder... Cos i dun rem seeing a silver car... But i thk i saw a black one...,,,
NOT SPAM,Lmao. Take a pic and send it to me.,,,
NOT SPAM,"\Speak only when you feel your words are better than the silence...\"" Gud mrng:-)""",,,
NOT SPAM,No. She's currently in scotland for that.,,,
NOT SPAM,Do you work all this week ?,,,
SPAM,Congratulations ur awarded either å£500 of CD gift vouchers & Free entry 2 our å£100 weekly draw txt MUSIC to 87066 TnCs www.Ldew.com 1 win150ppmx3age16,,,
NOT SPAM,Lol great now im getting hungry.,,,
NOT SPAM,Yes.. now only saw your message..,,,
NOT SPAM,I'll be at mu in like  &lt;#&gt;  seconds,,,
NOT SPAM,Ok...,,,
NOT SPAM,THING R GOOD THANX GOT EXAMS IN MARCH IVE DONE NO REVISION? IS FRAN STILL WITH BOYF? IVE GOTTA INTERVIW 4 EXETER BIT WORRIED!x,,,
NOT SPAM,"Tell you what, if you make a little spreadsheet and track whose idea it was to smoke to determine who \smokes too much\"" for the entire month of february"," I'll come up""",,
SPAM,For sale - arsenal dartboard. Good condition but no doubles or trebles!,,,
NOT SPAM,Don't look back at the building because you have no coat and i don't want you to get more sick. Just hurry home and wear a coat to the gym!!!,,,
NOT SPAM,"My painful personal thought- \I always try to keep everybody happy all the time. But nobody recognises me when i am alone\""""",,,
NOT SPAM,Thanks for ve lovely wisheds. You rock,,,
NOT SPAM,You intrepid duo you! Have a great time and see you both soon. ,,,
NOT SPAM,I asked sen to come chennai and search for job.,,,
NOT SPAM,Dad went out oredi... ,,,
NOT SPAM,"I jus hope its true that  missin me cos i'm really missin him! You haven't done anything to feel guilty about, yet.",,,
NOT SPAM,Wat so late still early mah. Or we juz go 4 dinner lor. Aiya i dunno...,,,
NOT SPAM,"Arms fine, how's Cardiff and uni? ",,,
NOT SPAM,In fact when do you leave? I think addie goes back to school tues or wed,,,
NOT SPAM,"Cool breeze... Bright sun... Fresh flower... Twittering birds... All these waiting to wish u: \GOODMORNING &amp; HAVE A NICE DAY\"" :)""",,,
NOT SPAM,Ya:)going for restaurant..,,,
NOT SPAM,"Its ok., i just askd did u knw tht no?",,,
SPAM,Free 1st week entry 2 TEXTPOD 4 a chance 2 win 40GB iPod or å£250 cash every wk. Txt POD to 84128 Ts&Cs www.textpod.net custcare 08712405020.,,,
NOT SPAM,Those ducking chinchillas,,,
NOT SPAM,I am in a marriage function,,,
NOT SPAM,Looks like u wil b getting a headstart im leaving here bout 2.30ish but if u r desperate for my company I could head in earlier-we were goin to meet in rummer.,,,
NOT SPAM,Don‰Û÷t give a flying monkeys wot they think and I certainly don‰Û÷t mind. Any friend of mine and all that!,,,
SPAM,As a registered optin subscriber ur draw 4 å£100 gift voucher will be entered on receipt of a correct ans to 80062 Whats No1 in the BBC charts,,,
NOT SPAM,say thanks2. ,,,
NOT SPAM,Msg me when rajini comes.,,,
NOT SPAM,Ya! when are Ì_ taking ure practical lessons? I start in june..  ,,,
NOT SPAM,"That's good, because I need drugs",,,
NOT SPAM,Stupid.its not possible,,,
NOT SPAM,Can Ì_ all decide faster cos my sis going home liao..,,,
SPAM,Summers finally here! Fancy a chat or flirt with sexy singles in yr area? To get MATCHED up just reply SUMMER now. Free 2 Join. OptOut txt STOP Help08714742804,,,
NOT SPAM,U sleeping now.. Or you going to take? Haha.. I got spys wat.. Me online checking n replying mails lor..,,,
SPAM,CLAIRE here am havin borin time & am now alone U wanna cum over 2nite? Chat now 09099725823 hope 2 C U Luv CLAIRE xx Callså£1/minmoremobsEMSPOBox45PO139WA,,,
NOT SPAM,"Fighting with the world is easy, u either win or lose bt fightng with some1 who is close to u is dificult if u lose - u lose if u win - u still lose.",,,
SPAM,Bought one ringtone and now getting texts costing 3 pound offering more tones etc,,,
NOT SPAM,"Yalru lyfu astne chikku.. Bt innu mundhe lyf ali halla ke bilo (marriage)program edhae, so lyf is nt yet ovr chikku..ali vargu lyfu meow meow:-D",,,
NOT SPAM,Kinda. First one gets in at twelve! Aah. Speak tomo,,,
SPAM,"09066362231 URGENT! Your mobile No 07xxxxxxxxx won a å£2,000 bonus caller prize on 02/06/03! this is the 2nd attempt to reach YOU! call 09066362231 ASAP!",,,
NOT SPAM,Ok good then i later come find Ì_... C lucky i told Ì_ to go earlier... Later pple take finish Ì_ no more again...,,,
NOT SPAM,Wat makes u thk i'll fall down. But actually i thk i'm quite prone 2 falls. Lucky my dad at home i ask him come n fetch me already.,,,
SPAM,"YOU 07801543489 are guaranteed the latests Nokia Phone, a 40GB iPod MP3 player or a å£500 prize! Txt word:COLLECT to No:83355! TC-LLC NY-USA 150p/Mt msgrcvd18+",,,
NOT SPAM,Your account has been refilled successfully by INR  &lt;DECIMAL&gt; . Your KeralaCircle prepaid account balance is Rs  &lt;DECIMAL&gt; . Your Transaction ID is KR &lt;#&gt; .,,,
NOT SPAM,I wont touch you with out your permission.,,,
SPAM,Hi its LUCY Hubby at meetins all day Fri & I will B alone at hotel U fancy cumin over? Pls leave msg 2day 09099726395 Lucy x Callså£1/minMobsmoreLKPOBOX177HP51FL,,,
NOT SPAM,"7 wonders in My WORLD 7th You 6th Ur style 5th Ur smile 4th Ur Personality 3rd Ur Nature 2nd Ur SMS and 1st \Ur Lovely Friendship\""... good morning dear""",,,
NOT SPAM,Take some small dose tablet for fever,,,
NOT SPAM,Oh. U must have taken your REAL Valentine out shopping first.,,,
NOT SPAM,"Just sent you an email ‰ÛÒ to an address with incomm in it, is that right?",,,
NOT SPAM,"Will do, you gonna be at blake's all night? I might be able to get out of here a little early",,,
NOT SPAM,"Friendship is not a game to play, It is not a word to say, It doesn\'t start on March and ends on May, It is tomorrow, yesterday, today and e",,,
NOT SPAM,"Nice. Wait...should you be texting right now? I'm not gonna pay your ticket, ya know!",,,
NOT SPAM,I'm watching lotr w my sis dis aft. So u wan 2 meet me 4 dinner at nite a not?,,,
NOT SPAM,Why you keeping me away like this,,,
NOT SPAM,I think its far more than that but find out. Check google maps for a place from your dorm.,,,
NOT SPAM,My trip was ok but quite tiring lor. Uni starts today but it's ok 4 me cos i'm not taking any modules but jus concentrating on my final yr project.,,,
NOT SPAM,Have you always been saying welp?,,,
NOT SPAM,"I'm a guy, browsin is compulsory",,,
NOT SPAM,Ok...,,,
NOT SPAM,Purity of friendship between two is not about smiling after reading the forwarded message..Its about smiling just by seeing the name. Gud evng musthu,,,
NOT SPAM,"Sorry, I'll call later",,,
NOT SPAM,"(I should add that I don't really care and if you can't I can at least get this dude to fuck off but hey, your money if you want it)",,,
NOT SPAM,"Hello lover! How goes that new job? Are you there now? Are you happy? Do you think of me? I wake, my slave and send you a teasing kiss from across the sea",,,
NOT SPAM,I told your number to gautNOT SPAM..,,,
NOT SPAM,Tell them no need to investigate about me anywhere.,,,
NOT SPAM,Ok i juz receive..,,,
NOT SPAM,"Cant believe i said so many things to you this morning when all i really wanted to say was good morning, i love you! Have a beautiful morning. See you in the library later.",,,
SPAM,"Your account has been credited with 500 FREE Text Messages. To activate, just txt the word: CREDIT to No: 80488 T&Cs www.80488.biz",,,
NOT SPAM,In the end she might still vomit but its okay. Not everything will come out.,,,
NOT SPAM,How are you with moneY...as in to you...money aint a thing....how are you sha!,,,
NOT SPAM,It has everything to do with the weather. Keep extra warm. Its a cold but nothing serious. Pls lots of vitamin c,,,
NOT SPAM,Hey gals.. Anyone of u going down to e driving centre tmr?,,,
NOT SPAM,I'm always on yahoo messenger now. Just send the message to me and i.ll get it you may have to send it in the mobile mode sha but i.ll get it. And will reply.,,,
NOT SPAM,I'm putting it on now. It should be ready for  &lt;TIME&gt; ,,,
NOT SPAM,"Time n Smile r the two crucial things in our life. Sometimes time makes us to forget smile, and sometimes someone's smile makes us to forget time gud noon",,,
SPAM,"SMS. ac JSco: Energy is high, but u may not know where 2channel it. 2day ur leadership skills r strong. Psychic? Reply ANS w/question. End? Reply END JSCO",,,
NOT SPAM,Host-based IDPS for linux systems.,,,
SPAM,"HOT LIVE FANTASIES call now 08707509020 Just 20p per min NTT Ltd, PO Box 1327 Croydon CR9 5WB 0870 is a national rate call",,,
NOT SPAM,Don no da:)whats you plan?,,,
NOT SPAM,Ill be there on  &lt;#&gt;  ok.,,,
NOT SPAM,Oh my God. I'm almost home,,,
NOT SPAM,Total video converter free download type this in google search:),,,
SPAM,Thanks for the Vote. Now sing along with the stars with Karaoke on your mobile. For a FREE link just reply with SING now.,,,
NOT SPAM,"Wen ur lovable bcums angry wid u, dnt take it seriously.. Coz being angry is d most childish n true way of showing deep affection, care n luv!.. kettoda manda... Have nice day da.",,,
NOT SPAM,Sounds like something that someone testing me would sayy,,,
NOT SPAM,When u love someone Dont make them to love u as much as u do. But Love them so much that they dont want to be loved by anyone except you... Gud nit.,,,
NOT SPAM,"Pete,is this your phone still? Its Jenny from college and Leanne.what are you up to now?:)",,,
NOT SPAM,Oops sorry. Just to check that you don't mind picking me up tomo at half eight from station. Would that be ok?,,,
NOT SPAM,"Hey sweet, I was wondering when you had a moment if you might come to me ? I want to send a file to someone but it won't go over yahoo for them because their connection sucks, remember when you set up that page for me to go to and download the format disc ? Could you tell me how to do that ? Or do you know some other way to download big files ? Because they can download stuff directly from the internet. Any help would be great, my prey ... *teasing kiss*",,,
NOT SPAM,Hows the cNOT SPAMp just leaving glasgow!,,,
NOT SPAM,K:)all the best:)congrats...,,,
NOT SPAM,I wonder if you'll get this text?,,,
NOT SPAM,I need to come home and give you some good lovin...,,,
SPAM,Our brand new mobile music service is now live. The free music player will arrive shortly. Just install on your phone to browse content from the top artists.,,,
NOT SPAM,Shall i ask one thing if you dont mistake me.,,,
NOT SPAM,Check wid corect speling i.e. Sarcasm,,,
SPAM,"URGENT! Your Mobile No was awarded a å£2,000 Bonus Caller Prize on 1/08/03! This is our 2nd attempt to contact YOU! Call 0871-4719-523 BOX95QU BT National Rate",,,
NOT SPAM,Are you angry with me. What happen dear,,,
NOT SPAM,I thk u dun haf 2 hint in e forum already lor... Cos i told ron n darren is going 2 tell shuhui.,,,
NOT SPAM,Yup ok thanx...,,,
NOT SPAM,Hi:)cts employee how are you?,,,
NOT SPAM,Pls pls find out from aunt nike.,,,
NOT SPAM,"Wow ... I love you sooo much, you know ? I can barely stand it ! I wonder how your day goes and if you are well, my love ... I think of you and miss you",,,
NOT SPAM,No screaming means shouting..,,,
NOT SPAM,Hey what happen de. Are you alright.,,,
NOT SPAM,Should I have picked up a receipt or something earlier,,,
NOT SPAM,I think chennai well settled?,,,
NOT SPAM,Oh dang! I didn't mean o send that to you! Lol!,,,
NOT SPAM,Unfortunately i've just found out that we have to pick my sister up from the airport that evening so don't think i'll be going out at all. We should try to go out one of th,,,
NOT SPAM,Horrible bf... I now v hungry...,,,
NOT SPAM,Remember on that day..,,,
SPAM,You have won a Nokia 7250i. This is what you get when you win our FREE auction. To take part send Nokia to 86021 now. HG/Suite342/2Lands Row/W1JHL 16+,,,
NOT SPAM,How's it feel? Mr. Your not my real Valentine just my yo Valentine even tho u hardly play!!,,,
NOT SPAM,All sounds good. Fingers . Makes it difficult to type,,,
NOT SPAM,Midnight at the earliest,,,
NOT SPAM,You're not sure that I'm not trying to make xavier smoke because I don't want to smoke after being told I smoke too much?,,,
NOT SPAM,K come to nordstrom when you're done,,,
NOT SPAM,Do u konw waht is rael FRIENDSHIP Im gving yuo an exmpel: Jsut ese tihs msg.. Evrey splleing of tihs msg is wrnog.. Bt sitll yuo can raed it wihtuot ayn mitsake.. GOODNIGHT &amp; HAVE A NICE SLEEP..SWEET DREAMS..,,,
NOT SPAM,Now press conference da:),,,
SPAM,"Hello from Orange. For 1 month's free access to games, news and sport, plus 10 free texts and 20 photo messages, reply YES. Terms apply: www.orange.co.uk/ow",,,
NOT SPAM,After completed degree. There is no use in joining finance.,,,
NOT SPAM,"Good afternoon, my love ! Any job prospects ? Are you missing me ? What do you do ? Are you being lazy and bleak, hmmm ? Or happy and filled with my love ?",,,
NOT SPAM,Shant disturb u anymore... Jia you...,,,
NOT SPAM,Bishan lar nearer... No need buy so early cos if buy now i gotta park my car...,,,
NOT SPAM,"Me, i dont know again oh",,,
NOT SPAM,Dude sux for snake. He got old and raiden got buff,,,
NOT SPAM,He says hi and to get your ass back to south tampa (preferably at a kegger),,,
NOT SPAM,In e msg jus now. U said thanks for gift.,,,
NOT SPAM,U too...,,,
NOT SPAM,Ok how you dear. Did you call chechi,,,
NOT SPAM,Yeah we do totes. When u wanna?,,,
NOT SPAM,Ok i found dis pierre cardin one which looks normal costs 20 its on sale.,,,
NOT SPAM,Good sleep is about rhythm. The person has to establish a rhythm that the body will learn and use. If you want to know more :-),,,
NOT SPAM,Wat r u doing?,,,
NOT SPAM,Message from . I am at Truro Hospital on ext. You can phone me here. as I have a phone by my side,,,
NOT SPAM,"Single line with a big meaning::::: \Miss anything 4 ur \""Best Life\"" but"," don't miss ur best life for anything... Gud nyt...""",,
NOT SPAM,"Just got some gas money, any chance you and the gang want to go on a grand nature adventure?",,,
NOT SPAM,Dnt worry...use ice pieces in a cloth pack.also take 2 tablets.,,,
NOT SPAM,Dude just saw a parked car with its sunroof popped up. Sux,,,
NOT SPAM,Get ready to put on your excellent sub face :),,,
NOT SPAM,Tmrw. Im finishing 9 doors,,,
NOT SPAM,"The  &lt;#&gt; g that i saw a few days ago, the guy wants sell wifi only for  &lt;#&gt;  and with 3g for  &lt;#&gt; . That's why i blanked him.",,,
NOT SPAM,I am late. I will be there at,,,
NOT SPAM,"whatever, im pretty pissed off.",,,
NOT SPAM,Today is ACCEPT DAY..U Accept me as? Brother Sister Lover Dear1 Best1 Clos1 Lvblefrnd Jstfrnd Cutefrnd Lifpartnr Belovd Swtheart Bstfrnd No rply means enemy,,,
NOT SPAM,I dont have that much image in class.,,,
NOT SPAM,No:-)i got rumour that you going to buy apartment in chennai:-),,,
NOT SPAM,Near kalainar tv office.thenampet,,,
SPAM,Ur cash-balance is currently 500 pounds - to maximize ur cash-in now send GO to 86688 only 150p/msg. CC 08718720201 HG/Suite342/2Lands Row/W1J6HL,,,
SPAM,SMS AUCTION - A BRAND NEW Nokia 7250 is up 4 auction today! Auction is FREE 2 join & take part! Txt NOKIA to 86021 now! HG/Suite342/2Lands Row/W1J6HL,,,
NOT SPAM,My sis is catching e show in e afternoon so i'm not watching w her. So c u wan 2 watch today or tmr lor.,,,
NOT SPAM,"Sounds gd... Haha... Can... Wah, u yan jiu so fast liao...",,,
NOT SPAM,No. To be nosy I guess. Idk am I over reacting if I'm freaked?,,,
NOT SPAM,"Remember all those whom i hurt during days of satanic imposter in me.need to pay a price,so be it.may destiny keep me going and as u said pray that i get the mind to get over the same.",,,
NOT SPAM,How to Make a girl Happy? It's not at all difficult to make girls happy. U only need to be... 1. A friend 2. Companion 3. Lover 4. Chef . . .  &lt;#&gt; . Good listener  &lt;#&gt; . Organizer  &lt;#&gt; . Good boyfriend  &lt;#&gt; . Very clean  &lt;#&gt; . Sympathetic  &lt;#&gt; . Athletic  &lt;#&gt; . Warm . . .  &lt;#&gt; . Courageous  &lt;#&gt; . Determined  &lt;#&gt; . True  &lt;#&gt; . Dependable  &lt;#&gt; . Intelligent . . .  &lt;#&gt; . Psychologist  &lt;#&gt; . Pest exterminator  &lt;#&gt; . Psychiatrist  &lt;#&gt; . Healer . .  &lt;#&gt; . Stylist  &lt;#&gt; . Driver . . Aaniye pudunga venaam..,,,
NOT SPAM,"Why is that, princess? I bet the brothas are all chasing you!",,,
NOT SPAM,"I shall book chez jules for half eight, if that's ok with you?",,,
NOT SPAM,Hhahhaahahah rofl wtf nig was leonardo in your room or something,,,
NOT SPAM,"Yep, at derek's house now, see you Sunday &lt;3",,,
NOT SPAM,"It's cool, let me know before it kicks off around  &lt;#&gt; , I'll be out and about all day",,,
NOT SPAM,"Sorry, I'll call later",,,
NOT SPAM,I was wondering if it would be okay for you to call uncle john and let him know that things are not the same in nigeria as they r here. That  &lt;#&gt;  dollars is 2years sent and that you know its a strain but i plan to pay back every dime he gives. Every dime so for me to expect anything from you is not practical. Something like that.,,,
NOT SPAM,There are no other charges after transfer charges and you can withdraw anyhow you like,,,
NOT SPAM,"Dont search love, let love find U. Thats why its called falling in love, bcoz U dont force yourself, U just fall and U know there is smeone to hold U... BSLVYL",,,
NOT SPAM,At 4. Let's go to bill millers,,,
NOT SPAM,I love you. You set my soul on fire. It is not just a spark. But it is a flame. A big rawring flame. XoXo,,,
NOT SPAM,"Somewhr someone is surely made 4 u. And God has decided a perfect time to make u meet dat person. . . . till den, . . . . . Enjoy ur crushes..!!!;-)",,,
NOT SPAM,That's my honeymoon outfit. :),,,
NOT SPAM,Will it help if we propose going back again tomorrow,,,
SPAM,PRIVATE! Your 2003 Account Statement for shows 800 un-redeemed S. I. M. points. Call 08719899230 Identifier Code: 41685 Expires 07/11/04,,,
NOT SPAM,Never blame a day in ur life. Good days give u happiness. Bad days give u experience. Both are essential in life! All are Gods blessings! good morning.:,,,
NOT SPAM,Pls confirm the time to collect the cheque.,,,
SPAM,As a Registered Subscriber yr draw 4 a å£100 gift voucher will b entered on receipt of a correct ans. When are the next olympics. Txt ans to 80062,,,
SPAM,URGENT! Your Mobile number has been awarded with a å£2000 prize GUARANTEED. Call 09061790121 from land line. Claim 3030. Valid 12hrs only 150ppm,,,
NOT SPAM,Daddy will take good care of you :),,,
NOT SPAM,"Yeah probably, I still gotta check out with leo",,,
NOT SPAM,K.then any other special?,,,
NOT SPAM,Carlos is taking his sweet time as usual so let me know when you and patty are done/want to smoke and I'll tell him to haul ass,,,
NOT SPAM,Ok pa. Nothing problem:-),,,
NOT SPAM,Have you heard about that job? I'm going to that wildlife talk again tonight if u want2come. Its that2worzels and a wizzle or whatever it is?! ,,,
NOT SPAM,"God picked up a flower and dippeditinaDEW, lovingly touched itwhichturnedinto u, and the he gifted tomeandsaid,THIS FRIEND IS 4U",,,
NOT SPAM,When you came to hostel.,,,
NOT SPAM,Ok no prob... I'll come after lunch then...,,,
NOT SPAM,Jus telling u dat i'll b leaving 4 shanghai on 21st instead so we'll haf more time 2 meet up cya...,,,
