v1,v2,,,
NOT SPAM,"\Life is nothing wen v get everything\"". But \""life is everything wen v miss something \"". Real value of people wil be realized only in their absence.... gud mrng""",,,
NOT SPAM,how are you? I miss you!,,,
NOT SPAM,I ain't answerin no phone at what is actually a pretty reasonable hour but I'm sleepy,,,
NOT SPAM,"Hey , is * rite u put åÈ10 evey mnth is that all?",,,
NOT SPAM,i am going to bed now prin,,,
NOT SPAM,I think just yourself ‰Û_Thanks and see you tomo,,,
NOT SPAM,If u dun drive then how i go 2 sch.,,,
NOT SPAM,I not at home now lei...,,,
SPAM,GSOH? Good with SPAM the ladies?U could b a male gigolo? 2 join the uk's fastest growing mens club reply ONCALL. mjzgroup. 08714342399.2stop reply STOP. msg@å£1.50rcvd,,,
NOT SPAM,Ok then i will come to ur home after half an hour,,,
SPAM,U have a secret admirer who is looking 2 make contact with U-find out who they R*reveal who thinks UR so special-call on 09058094599,,,
NOT SPAM,Do u hav any frnd by name ashwini in ur college?,,,
NOT SPAM,Jus finish my lunch on my way home lor... I tot u dun wan 2 stay in sch today...,,,
NOT SPAM,K then 2marrow are you coming to class.,,,
SPAM,"HOT LIVE FANTASIES call now 08707500020 Just 20p per min NTT Ltd, PO Box 1327 Croydon CR9 5WB 0870 is a national rate call",,,
NOT SPAM,Pls send me your address sir.,,,
NOT SPAM,I want to lick your pussy now...,,,
NOT SPAM,"Yo, you gonna still be in stock tomorrow/today? I'm trying to get a dubsack",,,
SPAM,URGENT! Your Mobile number has been awarded a <UKP>2000 prize GUARANTEED. Call 09061790125 from landline. Claim 3030. Valid 12hrs only 150ppm,,,
NOT SPAM,"I'll see, but prolly yeah",,,
NOT SPAM,Thought we could go out for dinner. I'll treat you! Seem ok?,,,
NOT SPAM,Where are you ? What do you do ? How can you stand to be away from me ? Doesn't your heart ache without me ? Don't you wonder of me ? Don't you crave me ?,,,
NOT SPAM,Sorry. You never hear unless you book it. One was kinda a joke--thet were really looking for skinny white girls. The other was one line--you can only do so much on camera with that. Something like that they're casting on the look.,,,
NOT SPAM,What you doing?how are you?,,,
NOT SPAM,"Sure thing big man. i have hockey elections at 6, shouldn‰Û÷t go on longer than an hour though",,,
NOT SPAM,Watch lor. I saw a few swatch one i thk quite ok. Ard 116 but i need 2nd opinion leh...,,,
NOT SPAM,Hiya do u like the hlday pics looked horrible in them so took mo out! Hows the camp Amrca thing? Speak soon Serena:),,,
NOT SPAM,"Babe! How goes that day ? What are you up to ? I miss you already, my Love ... * loving kiss* ... I hope everything goes well.",,,
NOT SPAM,Yunny... I'm goin to be late,,,
NOT SPAM,Doc prescribed me morphine cause the other pain meds aren't enough. Waiting for my mom to bring it. That med should kick in fast so I'm gonna try to be on later,,,
NOT SPAM,"Cool, want me to go to kappa or should I meet you outside mu",,,
NOT SPAM,"Hey sexy buns ! Have I told you ? I adore you, loverboy. I hope you remember to thank your sister in law for those meatballs *grins* ... i love you, babe",,,
NOT SPAM,May b approve panalam...but it should have more posts..,,,
SPAM,"SPJanuary Male Sale! Hot Gay chat now cheaper, call 08709222922. National rate from 1.5p/min cheap to 7.8p/min peak! To stop texts call 08712460324 (10p/min)",,,
NOT SPAM,"Sorry, I'll call later",,,
NOT SPAM,I dont thnk its a wrong calling between us,,,
NOT SPAM,Me i'm not workin. Once i get job...,,,
NOT SPAM,And by when you're done I mean now,,,
NOT SPAM,\Its Ur luck to Love someone. Its Ur fortune to Love the one who Loves U. But," its a miracle to Love a person who can't Love anyone except U...\"" Gud nyt...""",,
NOT SPAM,Hi baby ive just got back from work and i was wanting to see u allday! I hope i didnt piss u off on the phone today. If u are up give me a call xxx,,,
SPAM,FreeMsg Today's the day if you are ready! I'm horny & live in your town. I love sex fun & games! Netcollex Ltd 08700621170150p per msg reply Stop to end,,,
NOT SPAM,Is it your yahoo boys that bring in the perf? Or legal.,,,
NOT SPAM,No need to say anything to me. I know i am an outsider,,,
NOT SPAM,have you ever had one foot before?,,,
NOT SPAM,Just got to  &lt;#&gt;,,,
NOT SPAM,"Good! No, don‰Û÷t need any receipts‰ÛÓwell done! (‰Û_) Yes, please tell . What‰Û÷s her number, i could ring her",,,
NOT SPAM,"Ever green quote ever told by Jerry in cartoon \A Person Who Irritates u Always Is the one Who Loves u Vry Much But Fails to Express It...!..!! :-) :-) gud nyt""",,,
NOT SPAM,Leave it wif me lar... ÌÏ wan to carry meh so heavy... Is da num 98321561 familiar to Ì_?,,,
NOT SPAM,Beautiful truth : Expression of the face could Be seen by everyone... But the depression of heart Could be understood only By the Loved ones.. Gud Ni8;-),,,
NOT SPAM,Infact happy new year. How are you where are you when are we seeing,,,
SPAM,"In The Simpsons Movie released in July 2007 name the band that died at the start of the film? A-Green Day, B-Blue Day, C-Red Day. (Send A, B or C)",,,
NOT SPAM,That's a sNOT SPAMe! Maybe cld meet for few hrs tomo?,,,
NOT SPAM,Lol I would but despite these cramps I like being a girl.,,,
NOT SPAM,I canåÕt wait for cornwall. Hope tonight isnåÕt too bad as well but itåÕs rock night shite. Anyway iåÕm going for a kip now have a good night. Speak to you soon.,,,
NOT SPAM,Pls help me tell sura that i'm expecting a battery from hont. And that if should pls send me a message about how to download movies. Thanks,,,
SPAM,Please call Amanda with regard to renewing or upgrading your current T-Mobile handset free of charge. Offer ends today. Tel 0845 021 3680 subject to T's and C's,,,
NOT SPAM,"Haven't found a way to get another app for your phone, eh ? Will you go to the net cafe ? Did you take that job? Geeee I need you babe. I crave to see you ...",,,
NOT SPAM,I only work from mon to thurs but Sat i cant leh... Booked liao... Which other day u free?,,,
NOT SPAM,ÌÏ comin to fetch us oredi...,,,
NOT SPAM,What's nannys address?,,,
SPAM,"URGENT!! Your 4* Costa Del Sol Holiday or å£5000 await collection. Call 09050090044 Now toClaim. SAE, TC s, POBox334, Stockport, SK38xh, Costå£1.50/pm, Max10mins",,,
NOT SPAM,Haf u eaten? Wat time u wan me 2 come?,,,
SPAM,Want a new Video Phone? 750 anytime any network mins? Half price line rental free text for 3 months? Reply or call 08000930705 for free delivery,,,
NOT SPAM,"Yo, call me when you get the chance, a friend of mine wanted me to ask you about a big order",,,
NOT SPAM,This single single answers are we fighting? Plus i said am broke and you didnt reply,,,
NOT SPAM,It certainly puts things into perspective when something like this happens,,,
NOT SPAM,Now got tv 2 watch meh? U no work today?,,,
NOT SPAM,i felt so...not any conveying reason.. Ese he... What about me?,,,
SPAM,Had your mobile 11 months or more? U R entitled to Update to the latest colour mobiles with camera for Free! Call The Mobile Update Co FREE on 08002986030,,,
NOT SPAM,How's it going? Got any exciting karaoke type activities planned? I'm debating whether to play football this eve. Feeling lazy though.,,,
NOT SPAM,I told that am coming on wednesday.,,,
NOT SPAM,"Its ok, called mom instead have fun",,,
SPAM,"Dear Voucher Holder, To claim this weeks offer, at your PC please go to http://www.wtlp.co.uk/text. Ts&Cs apply.",,,
NOT SPAM,Well if I'm that desperate I'll just call armand again,,,
NOT SPAM,Are you at work right now ?,,,
SPAM,Congrats! Nokia 3650 video camera phone is your Call 09066382422 Calls cost 150ppm Ave call 3mins vary from mobiles 16+ Close 300603 post BCM4284 Ldn WC1N3XX,,,
NOT SPAM,Haven't heard anything and he's not answering my texts so I'm guessing he flaked. That said the jb is fantastic,,,
NOT SPAM,"Mmmmmm ... I love you,so much, Ahmad ... I can't wait for this year to begin as every second takes me closer to being at your side. Happy New Year, my love!!",,,
NOT SPAM,Pls what's the full name of joke's school cos fees in university of florida seem to actually be  &lt;#&gt; k. Pls holla back,,,
NOT SPAM,"Sorry, I'll call later",,,
NOT SPAM,Ok... But they said i've got wisdom teeth hidden inside n mayb need 2 remove.,,,
NOT SPAM,And pls pls drink plenty plenty water,,,
NOT SPAM,How are you doing. How's the queen. Are you going for the royal wedding,,,
NOT SPAM,He's in lag. That's just the sad part but we keep in touch thanks to skype,,,
NOT SPAM,Ok lor then we go tog lor...,,,
NOT SPAM,Two teams waiting for some players,,,
NOT SPAM,Can Ì_ send me a copy of da report?,,,
NOT SPAM,"swhrt how u dey,hope ur ok, tot about u 2day.love n miss.take care.",,,
NOT SPAM,"Ok da, i already planned. I wil pick you.",,,
SPAM,"Urgent! Please call 0906346330. Your ABTA complimentary 4* Spanish Holiday or å£10,000 cash await collection SAE T&Cs BOX 47 PO19 2EZ 150ppm 18+",,,
NOT SPAM,"Sorry, I'll call later in meeting",,,
NOT SPAM,I just really need shit before tomorrow and I know you won't be awake before like 6,,,
NOT SPAM,I'm good. Have you registered to vote?,,,
NOT SPAM,"Hmm ok, i'll stay for like an hour cos my eye is really sore!",,,
NOT SPAM,Dear got bus directly to calicut,,,
NOT SPAM,Mm umma ask vava also to come tell him can play later together,,,
NOT SPAM,"Well the general price is  &lt;#&gt; /oz, let me know if/when/how much you want",,,
NOT SPAM,"Sorry, I'll call later",,,
NOT SPAM,"Each Moment in a day,has its own value-Morning brings hope,afternoon brings faith,Evening brings luv,Night brings rest,Wish u find them all today.Good Morning",,,
NOT SPAM,&lt;#&gt;  w jetton ave if you forgot,,,
NOT SPAM,Ok i'm coming home now.,,,
NOT SPAM,Can not use foreign stamps in this country.,,,
SPAM,"Double mins and txts 4 6months FREE Bluetooth on Orange. Available on Sony, Nokia Motorola phones. Call MobileUpd8 on 08000839402 or call2optout/N9DX",,,
NOT SPAM,"Sorry, it's a lot of friend-of-a-friend stuff, I'm just now about to talk to the actual guy who wants to buy",,,
SPAM,FREE for 1st week! No1 Nokia tone 4 ur mob every week just txt NOKIA to 8007 Get txting and tell ur mates www.getzed.co.uk POBox 36504 W45WQ norm150p/tone 16+,,,
SPAM,"Want to funk up ur fone with a weekly new tone reply TONES2U 2 this text. www.ringtones.co.uk, the original n best. Tones 3GBP network operator rates apply",,,
SPAM,"cmon babe, make me horny, *turn* me on! Txt me your fantasy now babe -) Im hot, sticky and need you now. All replies cost å£1.50. 2 cancel send STOP",,,
NOT SPAM,I will come tomorrow di,,,
NOT SPAM,Wylie update: my weed dealer carlos went to freedom and had a class with lunsford,,,
NOT SPAM,Are you happy baby ? Are you alright ? Did you take that job ? I hope your fine. I send you a kiss to make you smile from across the sea ... *kiss* *kiss*,,,
NOT SPAM,C movie is juz last minute decision mah. Juz watch 2 lar but i tot Ì_ not interested.,,,
NOT SPAM,How are you enjoying this semester? Take care brother.,,,
SPAM,IMPORTANT INFORMATION 4 ORANGE USER 0796XXXXXX. TODAY IS UR LUCKY DAY!2 FIND OUT WHY LOG ONTO http://www.urawinner.com THERE'S A FANTASTIC PRIZEAWAITING YOU!,,,
NOT SPAM,"Get the door, I'm here",,,
NOT SPAM,"Lets use it next week, princess :)",,,
NOT SPAM,Or i go home first lar Ì_ wait 4 me lor.. I put down my stuff first..,,,
NOT SPAM,I want kfc its Tuesday. Only buy 2 meals ONLY 2. No gravy. Only 2 Mark. 2!,,,
NOT SPAM,No da:)he is stupid da..always sending like this:)don believe any of those message.pandy is a mental:),,,
NOT SPAM,Oi when you gonna ring,,,
SPAM,Missed call alert. These numbers called but left no message. 07008009200,,,
NOT SPAM,I attended but nothing is there.,,,
NOT SPAM,Ard 530 like dat lor. We juz meet in mrt station then Ì_ dun haf to come out.,,,
NOT SPAM,No dear i was sleeping :-P,,,
NOT SPAM,Er mw im filled tuth is aight,,,
NOT SPAM,Will be office around 4 pm. Now i am going hospital.,,,
NOT SPAM,Actually i'm waiting for 2 weeks when they start putting ad.,,,
NOT SPAM,Anything lor if they all go then i go lor...,,,
NOT SPAM,U free on sat rite? U wan 2 watch infernal affairs wif me n darren n mayb xy?,,,
NOT SPAM,"Plz note: if anyone calling from a mobile Co. &amp; asks u to type # &lt;#&gt;  or # &lt;#&gt; . Do not do so. Disconnect the call,coz it iz an attempt of 'terrorist' to make use of the sim card no. Itz confirmd by nokia n motorola n has been verified by CNN IBN.",,,
NOT SPAM,Yo you around? A friend of mine's lookin to pick up later tonight,,,
NOT SPAM,Stupid auto correct on my phone,,,
NOT SPAM,Double eviction this week - Spiral and Michael and good riddance to them!,,,
NOT SPAM,"\The world suffers a lot... Not because of the violence of bad people. But because of the silence of good people!\"""," Gud night....""",,
NOT SPAM,"Ok thats cool. Its , just off either raglan rd or edward rd. Behind the cricket ground. Gimme ring when ur closeby see you tuesday.",,,
NOT SPAM,Buy one egg for me da..please:),,,
NOT SPAM,Have you started in skye,,,
NOT SPAM,Have you bookedthe hut? And also your time off? How are you by the way?,,,
NOT SPAM,And several to you sir.,,,
NOT SPAM,U really pig leh sleep so much. My dad wake me up at 10 smth 2 eat lunch today.,,,
NOT SPAM,I'm at home. Please call,,,
NOT SPAM,My love ... I hope your not doing anything drastic. Don't you dare sell your pc or your phone ...,,,
NOT SPAM,Now only i reached home. . . I am very tired now. . I will come tomorro,,,
SPAM,FREEMSG: Our records indicate you may be entitled to 3750 pounds for the Accident you had. To claim for free reply with YES to this msg. To opt out text STOP,,,
SPAM,"U can WIN å£100 of Music Gift Vouchers every week starting NOW Txt the word DRAW to 87066 TsCs www.Idew.com SkillGame, 1Winaweek, age16. 150ppermessSubscription",,,
NOT SPAM,Life style garments account no please.,,,
NOT SPAM,Lol wtf random. Btw is that your lunch break,,,
NOT SPAM,"Sez, hows u & de arab boy? Hope u r all good give my love 2 evry1 love ya eshxxxxxxxxxxx",,,
NOT SPAM,"The LAY MAN! Just to let you know you are missed and thought off. Do have a great day. And if you can send me bimbo and ugo's numbers, ill appreciate. Safe",,,
NOT SPAM,Detroit. The home of snow. Enjoy it.,,,
SPAM,Show ur colours! Euro 2004 2-4-1 Offer! Get an England Flag & 3Lions tone on ur phone! Click on the following service message for info!,,,
NOT SPAM,Okie...,,,
NOT SPAM,"Aight, I'm chillin in a friend's room so text me when you're on the way",,,
NOT SPAM,Is toshiba portege m100 gd?,,,
NOT SPAM,Well welp is sort of a semiobscure internet thing,,,
SPAM,Text PASS to 69669 to collect your polyphonic ringtones. Normal gprs charges apply only. Enjoy your tones,,,
SPAM,"accordingly. I repeat, just text the word ok on your mobile phone and send",,,
NOT SPAM,Loosu go to hospital. De dont let it careless.,,,
NOT SPAM,How much for an eighth?,,,
NOT SPAM,Omg Joanna is freaking me out. She's looked thru all my friends to find photos of me. And then she's asking about stuff on my MySpace which I haven't even logged on in like a year. :/,,,
NOT SPAM,"Send ur birthdate with month and year, I will tel u ur LIFE PARTNER'S name. and the method of calculation. Reply must.",,,
NOT SPAM,Juz now havent woke up so a bit blur blur... Can? Dad went out liao... I cant cum now oso...,,,
NOT SPAM,"How about clothes, jewelry, and trips?",,,
SPAM,Block Breaker now comes in deluxe format with new features and great graphics from T-Mobile. Buy for just å£5 by replying GET BBDELUXE and take the challenge,,,
NOT SPAM,Aah! A cuddle would be lush! I'd need lots of tea and soup before any kind of fumbling!,,,
SPAM,important information 4 orange user . today is your lucky day!2find out why log onto http://www.urawinner.com THERE'S A FANTASTIC SURPRISE AWAITING YOU!,,,
NOT SPAM,I am late. I will be there at,,,
NOT SPAM,Sad story of a Man - Last week was my b'day. My Wife did'nt wish me. My Parents forgot n so did my Kids . I went to work. Even my Colleagues did not wish.,,,
NOT SPAM,Are you plans with your family set in stone ?,,,
NOT SPAM,Pls dont forget to study,,,
NOT SPAM,You'll never believe this but i have actually got off at taunton. Wow,,,
NOT SPAM,"Den only weekdays got special price... Haiz... Cant eat liao... Cut nails oso muz wait until i finish drivin wat, lunch still muz eat wat... ",,,
NOT SPAM,She just broke down a list of reasons why nobody's in town and I can't tell if she's being sarcastic or just faggy,,,
NOT SPAM, &lt;DECIMAL&gt; m but its not a common car here so its better to buy from china or asia. Or if i find it less expensive. I.ll holla,,,
NOT SPAM,The greatest test of courage on earth is to bear defeat without losing heart....gn tc,,,
NOT SPAM,SORRY IM STIL FUCKED AFTER LAST NITE WENT TOBED AT 430 GOT UP 4 WORK AT 630,,,
NOT SPAM,Hey so whats the plan this sat? ,,,
NOT SPAM,Beauty sleep can help ur pimples too.,,,
NOT SPAM,Great. Hope you are using your connections from mode men also cos you can never know why old friends can lead you to today,,,
SPAM,Natalja (25/F) is inviting you to be her friend. Reply YES-440 or NO-440 See her: www.SMS.ac/u/nat27081980 STOP? Send STOP FRND to 62468,,,
NOT SPAM,Where to get those?,,,
NOT SPAM,"Kind of. Just missed train cos of asthma attack, nxt one in half hr so driving in. not sure where to park.",,,
NOT SPAM,Ball is moving a lot.will spin in last :)so very difficult to bat:),,,
NOT SPAM,Haiyoh... Maybe your NOT SPAMster was jealous of million,,,
NOT SPAM,Can you please send me my aunty's number,,,
NOT SPAM,I'm glad. You are following your dreams.,,,
NOT SPAM,I've reached home finally...,,,
SPAM,"URGENT. Important information for 02 user. Today is your lucky day! 2 find out why , log onto http://www.urawinner.com there is a fantastic surprise awaiting you !",,,
SPAM,WINNER!! As a valued network customer you have been selected to receivea å£900 prize reward! To claim call 09061701461. Claim code KL341. Valid 12 hours only.,,,
NOT SPAM,"Wn u r hurt by d prsn who s close 2 u, do fight wit dem. Coz somtimes dis fight saves a relation bt being quiet leaves nothin in a relation.. Gud eveB-)",,,
NOT SPAM,U can call now...,,,
NOT SPAM,"Science tells that chocolate will melt under the sunlight. Please don't walk under the sunlight. BCoz,I don't want to loss a sweet friend.",,,
NOT SPAM,Yes. I come to nyc for audiitions and am trying to relocate.,,,
NOT SPAM,I pocked you up there before,,,
NOT SPAM,Congrats. That's great. I wanted to tell you not to tell me your score cos it might make me relax. But its motivating me so thanks for sharing,,,
NOT SPAM,I wud never mind if u dont miss me or if u dont need me.. But u wil really hurt me wen u need me &amp; u dont tell me......... Take care:-),,,
NOT SPAM,Hey mr whats the name of that bill brison book the one about language and words ,,,
NOT SPAM,"Okay, good, no problem, and thanx!",,,
NOT SPAM,"For you information, IKEA is spelled with all caps. That is not yelling. when you thought i had left you, you were sitting on the bed among the mess when i came in. i said we were going after you got home from class. please don't try and bullshit me. It makes me want to listen to you less.",,,
NOT SPAM,Call me when u're done...,,,
NOT SPAM,G.W.R,,,
NOT SPAM,You best watch what you say cause I get drunk as a motherfucker,,,
SPAM,Kit Strip - you have been billed 150p. Netcollex Ltd. PO Box 1013 IG11 OJA,,,
SPAM,HMV BONUS SPECIAL 500 pounds of genuine HMV vouchers to be won. Just answer 4 easy questions. Play Now! Send HMV to 86688 More info:www.100percent-real.com,,,
SPAM,Please CALL 08712402578 immediately as there is an urgent message waiting for you,,,
SPAM,thesmszone.com lets you send free anonymous and masked messages..im sending this message from there..do you see the potential for abuse???,,,
SPAM,"WELL DONE! Your 4* Costa Del Sol Holiday or å£5000 await collection. Call 09050090044 Now toClaim. SAE, TCs, POBox334, Stockport, SK38xh, Costå£1.50/pm, Max10mins",,,
NOT SPAM,Hurt me... Tease me... Make me cry... But in the end of my life when i die plz keep one rose on my grave and say STUPID I MISS U.. HAVE A NICE DAY BSLVYL,,,
NOT SPAM,"Erm... Woodland avenue somewhere. Do you get the parish magazine, his telephone number will be in there.",,,
NOT SPAM,Are there TA jobs available? Let me know please cos i really need to start working,,,
NOT SPAM,Aiyar hard 2 type. U later free then tell me then i call n scold n tell u.,,,
NOT SPAM,Yup i'm free...,,,
NOT SPAM,"Good good, billy mates all gone. Just been jogging, again! Did enjoy concert?",,,
NOT SPAM,Yo come over carlos will be here soon,,,
NOT SPAM,Awww dat is sweet! We can think of something to do he he! Have a nice time tonight ill probably txt u later cos im lonely :( xxx.,,,
NOT SPAM,I guess it is useless calling u 4 something important.,,,
NOT SPAM,Ha ha - had popped down to the loo when you hello-ed me. Hello!,,,
NOT SPAM,He dint tell anything. He is angry on me that why you told to abi.,,,
SPAM,Someone U know has asked our dating service 2 contact you! Cant Guess who? CALL 09058091854 NOW all will be revealed. PO BOX385 M6 6WU,,,
NOT SPAM,It so happens that there r 2waxsto do wat you want. She can come and ill get her medical insurance. And she'll be able to deliver and have basic care. I'm currently shopping for the right medical insurance for her. So just give me til friday morning. Thats when i.ll see the major person that can guide me to the right insurance.,,,
NOT SPAM,I keep ten rs in my shelf:) buy two egg.,,,
NOT SPAM,"I wasn't well babe, i have swollen glands at my throat ... What did you end up doing ?",,,
NOT SPAM,Is ur changes 2 da report big? Cos i've already made changes 2 da previous report.,,,
NOT SPAM,Captain is in our room:),,,
NOT SPAM,"I can't speak, bcaz mobile have problem. I can listen you but you cann't listen my voice. So i calls you later.",,,
NOT SPAM,HIYA STU WOT U UP 2.IM IN SO MUCH TRUBLE AT HOME AT MOMENT EVONE HATES ME EVEN U! WOT THE HELL AV I DONE NOW? Y WONT U JUST TELL ME TEXT BCK PLEASE LUV DAN ,,,
NOT SPAM,S...i will take mokka players only:),,,
NOT SPAM,Are you still playing with gautNOT SPAM?,,,
NOT SPAM,Hey mr  and I are going to the sea view and having a couple of gays I mean games! Give me a bell when ya finish ,,,
NOT SPAM,"K, jason says he's gonna be around so I'll be up there around  &lt;#&gt;",,,
NOT SPAM,Sorry . I will be able to get to you. See you in the morning.,,,
NOT SPAM,Aight well keep me informed,,,
NOT SPAM,I am not having her number sir,,,
NOT SPAM,Am only searching for good dual sim mobile pa.,,,
NOT SPAM,That seems unnecessarily hostile,,,
NOT SPAM,Dude got a haircut. Now its breezy up there,,,
SPAM,"Congrats! 2 mobile 3G Videophones R yours. call 09061744553 now! videochat wid ur mates, play java games, Dload polyH music, noline rentl. bx420. ip4. 5we. 150pm",,,
NOT SPAM,1Apple/Day=No Doctor. 1Tulsi Leaf/Day=No Cancer. 1Lemon/Day=No Fat. 1Cup Milk/day=No Bone Problms 3 Litres Watr/Day=No Diseases Snd ths 2 Whom U Care..:-),,,
NOT SPAM,i thought we were doing a king of the hill thing there.,,,
NOT SPAM,Nope i'll come online now..,,,
NOT SPAM,ALSO TELL HIM I SAID HAPPY BIRTHDAY,,,
NOT SPAM,Y bishan lei... I tot Ì_ say lavender? ,,,
NOT SPAM,Boo what time u get out? U were supposed to take me shopping today. :(,,,
NOT SPAM,"Now u sound like manky scouse boy steve,like! I is travelling on da bus home.wot has u inmind 4 recreation dis eve?",,,
NOT SPAM,"Fyi I'm taking a quick shower, be at epsilon in like  &lt;#&gt;  min",,,
NOT SPAM,on a Tuesday night r u 4 real,,,
NOT SPAM,Yes when is the appt again?,,,
NOT SPAM,Just got outta class gonna go gym.,,,
NOT SPAM,I want to sent  &lt;#&gt; mesages today. Thats y. Sorry if i hurts,,,
NOT SPAM,ÌÏ all write or wat..,,,
NOT SPAM,Ha! I wouldn't say that I just didn't read anything into way u seemed. I don't like 2 be judgemental....i save that for fridays in the pub!,,,
NOT SPAM,Its a valentine game. . . send dis msg to all ur friends. . If 5 answers r d same then someone really loves u. . Ques- which colour suits me the best?,,,
NOT SPAM,Hi:)did you asked to waheeda fathima about leave?,,,
NOT SPAM,Enjoy urself tmr...,,,
NOT SPAM,You still around? I could use a half-8th,,,
SPAM,U 447801259231 have a secret admirer who is looking 2 make contact with U-find out who they R*reveal who thinks UR so special-call on 09058094597,,,
NOT SPAM,You give us back my id proof and  &lt;#&gt;  rs. We wont allow you to work. We will come to your home within days,,,
NOT SPAM,ÌÏ bot notes oredi... Cos i juz rem i got...,,,
NOT SPAM,Yes. Rent is very expensive so its the way we save.,,,
NOT SPAM,"Night has ended for another day, morning has come in a special way. May you smile like the sunny rays and leaves your worries at the blue blue bay. Gud mrng",,,
NOT SPAM,Hows the pain dear?y r u smiling?,,,
NOT SPAM,"Fun fact: although you would think armand would eventually build up a tolerance or some shit considering how much he smokes, he gets fucked up in like 2 hits",,,
SPAM,important information 4 orange user 0789xxxxxxx. today is your lucky day!2find out why log onto http://www.urawinner.com THERE'S A FANTASTIC SURPRISE AWAITING YOU!,,,
NOT SPAM,"Sorry, I can't help you on this.",,,
NOT SPAM,Great. So should i send you my account number.,,,
NOT SPAM,"HELLOGORGEOUS, HOWS U? MY FONE WAS ON CHARGE LST NITW WEN U TEXD ME. HOPEU AD A NICE WKEND AS IM SURE U DID LOOKIN 4WARD 2 C-IN U 2MRW LUV JAZ",,,
SPAM,"Our dating service has been asked 2 contact U by someone shy! CALL 09058091870 NOW all will be revealed. POBox84, M26 3UZ 150p",,,
NOT SPAM,ÌÏ only send me the contents page...,,,
